{
  "$schema": "https://json-schema.org/draft/2020-12/schema",
  "$id": "https://audrey-memory.org/schemas/audrey-publication-pack.schema.json",
  "title": "Audrey Publication Pack",
  "type": "object",
  "additionalProperties": false,
  "required": ["schemaVersion", "suite", "claimRegister", "entries"],
  "properties": {
    "schemaVersion": { "const": "1.0.0" },
    "suite": { "const": "Audrey publication pack" },
    "claimRegister": { "type": "string", "minLength": 1 },
    "entries": {
      "type": "array",
      "minItems": 1,
      "items": { "$ref": "#/$defs/entry" }
    }
  },
  "$defs": {
    "entry": {
      "type": "object",
      "additionalProperties": false,
      "required": ["id", "platform", "kind", "claimIds", "maxChars", "text"],
      "properties": {
        "id": {
          "type": "string",
          "pattern": "^[a-z0-9][a-z0-9-]*$"
        },
        "platform": {
          "enum": ["arxiv", "hacker-news", "linkedin", "reddit", "x"]
        },
        "kind": {
          "enum": ["abstract", "body", "post", "title"]
        },
        "claimIds": {
          "type": "array",
          "minItems": 1,
          "items": {
            "type": "string",
            "pattern": "^C[0-9]{2}$"
          }
        },
        "maxChars": {
          "type": "integer",
          "minimum": 1
        },
        "requiresArtifactUrl": {
          "type": "boolean"
        },
        "reservedUrlChars": {
          "type": "integer",
          "minimum": 0
        },
        "text": {
          "type": "string",
          "minLength": 1
        }
      }
    }
  }
}
